{
    "label": "",
    "type": "document",
    "content": [],
    "children": [
        {
            "label": "1",
            "type": "heading",
            "content": [
                "Einf\u00fchrungsgesetz zum Krankenversicherungsgesetz. Nachtrag 2024"
            ],
            "children": []
        },
        {
            "label": "",
            "type": "table",
            "content": [
                "| Geltendes Recht | Vernehmlassungsvorlage des Regierungs-rats vom 10. September 2024 | Notizen |",
                "|-----------------|--------------------------------------------------|---------|",
                "| | Einf\u00fchrungsgesetz zum Krankenversicherungsgesetz (EG KVG) | |",
                "| | Der Kantonsrat des Kantons Obwalden | |",
                "| | beschliesst: | |",
                "| | I. | |",
                "| | Der Erlass GDB 851.1 (Einf\u00fchrungsgesetz zum Krankenversicherungsgesetz [EG KVG] vom 28. Januar 1999) (Stand 1. Januar 2022) wird wie folgt ge\u00e4ndert: | |"
            ],
            "children": []
        },
        {
            "label": "2",
            "type": "heading",
            "content": [
                "Art. 2"
            ],
            "children": [
                {
                    "label": "",
                    "type": "content",
                    "content": [
                        "Anspruch und Finanzierung der Pr\u00e4mienverbilligung"
                    ]
                }
            ]
        },
        {
            "label": "",
            "type": "table",
            "content": [
                "| Vernehmlassungsvorlage des Regierungs-rats vom 10. September 2024 |",
                "|-------------------------------------------------------------------|",
                "| [2.] Der Selbstbehalt entspricht einem bestimmten Prozentsatz des anrechenbaren Einkommens und betr\u00e4gt zwischen 9,0 und 11,5 Prozent. Der Prozentsatz verl\u00e4uft linear und steigt ab einer bestimmten Grenze des anrechenbaren Einkommens an (linear-progressives System). Er wird vom ~~Kantonsrat j\u00e4hrlich durch Kantonsratsbeschluss abschliessend~~Regierungsrat jeweils im Vorjahr festgelegt. |",
                "| Geltendes Recht | Vernehmlassungsvorlage des Regierungs-rats vom 10. September 2024 | Notizen |",
                "|-----------------|------------------------------------------------------------------|---------|"
            ],
            "children": [
                {
                    "label": "",
                    "type": "list",
                    "children": [
                        {
                            "label": "1.",
                            "type": "list_item",
                            "content": [
                                "Ein Anspruch auf Pr\u00e4mienverbilligung besteht, soweit die kantonalen Richtpr\u00e4mien der obligatorischen Krankenpflegegrundversicherung den Selbstbehalt gem\u00e4ss Absatz 2 \u00fcbersteigen und die Voraussetzungen gem\u00e4ss Art. 7 der Verordnung zum Einf\u00fchrungsgesetz zum Krankenversicherungsgesetz (V zum EG KVG)[^GDB 851.11] erf\u00fcllt sind."
                            ],
                            "children": []
                        },
                        {
                            "label": "2.",
                            "type": "list_item",
                            "content": [
                                "Der Selbstbehalt entspricht einem bestimmten Prozentsatz des anrechenbaren Einkommens. Der Prozentsatz verl\u00e4uft linear und steigt ab einer bestimmten Grenze des anrechenbaren Einkommens an (linear-progressives System). Er wird vom Kantonsrat j\u00e4hrlich durch Kantonsratsbeschluss abschliessend festgelegt."
                            ],
                            "children": []
                        },
                        {
                            "label": "3.",
                            "type": "list_item",
                            "content": [
                                "F\u00fcr untere und mittlere Einkommen werden die kantonalen Richtpr\u00e4mien von Kindern um mindestens 80 Prozent und von jungen Erwachsenen in Ausbildung um mindestens 50 Prozent gem\u00e4ss Art. 7 Abs. 3 und 4 V zum EG KVG verbilligt (Mindestanspruch)."
                            ],
                            "children": []
                        },
                        {
                            "label": "4.",
                            "type": "list_item",
                            "content": [
                                "Der in das Budget aufzunehmende Kantonsbeitrag entspricht mindestens 8,5 Prozent der Pr\u00e4mienkosten der obligatorischen Krankenpflegeversicherung des Kantons Obwalden. | [4.] Aufgehoben |"
                            ],
                            "children": []
                        },
                        {
                            "label": "5.",
                            "type": "list_item",
                            "content": [
                                "Die Pr\u00e4mienverbilligung darf, vorbeh\u00e4ltlich bundesrechtlicher Vorgaben, die im Anspruchsjahr geschuldeten Pr\u00e4mien f\u00fcr die obligatorische Krankenpflegeversicherung nicht \u00fcbersteigen."
                            ],
                            "children": []
                        }
                    ]
                }
            ]
        },
        {
            "label": "2",
            "type": "heading",
            "content": [
                "II."
            ],
            "children": [
                {
                    "label": "",
                    "type": "content",
                    "content": [
                        "Keine Fremd\u00e4nderungen."
                    ]
                }
            ]
        },
        {
            "label": "2",
            "type": "heading",
            "content": [
                "III."
            ],
            "children": [
                {
                    "label": "",
                    "type": "content",
                    "content": [
                        "Keine Fremdaufhebungen."
                    ]
                }
            ]
        },
        {
            "label": "2",
            "type": "heading",
            "content": [
                "IV."
            ],
            "children": [
                {
                    "label": "",
                    "type": "content",
                    "content": [
                        "Der Regierungsrat bestimmt, wann dieser Nachtrag in Kraft tritt. Er unterliegt dem fakultativen Referendum."
                    ]
                },
                {
                    "label": "",
                    "type": "content",
                    "content": [
                        "Sarnen, ..."
                    ]
                },
                {
                    "label": "",
                    "type": "content",
                    "content": [
                        "Im Namen des Kantonsrats:"
                    ]
                },
                {
                    "label": "",
                    "type": "content",
                    "content": [
                        "Der Ratspr\u00e4sident:"
                    ]
                },
                {
                    "label": "",
                    "type": "content",
                    "content": [
                        "Der Ratssekret\u00e4r:"
                    ]
                },
                {
                    "label": "",
                    "type": "content",
                    "content": [
                        "2"
                    ]
                }
            ]
        }
    ]
}