{
    "label": "",
    "type": "document",
    "content": [],
    "children": [
        {
            "label": "1",
            "type": "heading",
            "content": [
                "Legge federale sugli stranieri e la loro integrazione"
            ],
            "children": [
                {
                    "label": "",
                    "type": "content",
                    "content": [
                        "(LStrI)"
                    ]
                },
                {
                    "label": "",
                    "type": "content",
                    "content": [
                        "(Nessuna perdita del diritto di soggiorno in caso di dipendenza dall'aiuto sociale senza propria colpa)"
                    ]
                },
                {
                    "label": "",
                    "type": "content",
                    "content": [
                        "Progetto preliminare"
                    ]
                },
                {
                    "label": "",
                    "type": "content",
                    "content": [
                        "Modifica del ..."
                    ]
                },
                {
                    "label": "",
                    "type": "content",
                    "content": [
                        "L'Assemblea federale della Confederazione Svizzera,"
                    ]
                },
                {
                    "label": "",
                    "type": "content",
                    "content": [
                        "visto il rapporto della Commissione delle istituzioni politiche del Consiglio nazionale del [data della decisione della Commissione][^FF 2024 ...];"
                    ]
                },
                {
                    "label": "",
                    "type": "content",
                    "content": [
                        "visto il parere del Consiglio federale del [data][^FF 2024 ...],"
                    ]
                },
                {
                    "label": "",
                    "type": "content",
                    "content": [
                        "decreta:"
                    ]
                },
                {
                    "label": "",
                    "type": "content",
                    "content": [
                        "I"
                    ]
                },
                {
                    "label": "",
                    "type": "content",
                    "content": [
                        "La legge federale del 16 dicembre 2005[^RS 142.20] sugli stranieri e la loro integrazione \u00e8 modificata come segue:"
                    ]
                }
            ]
        },
        {
            "label": "2",
            "type": "heading",
            "content": [
                "Art. 62 cpv. 1bis"
            ],
            "children": [
                {
                    "label": "",
                    "type": "list",
                    "children": [
                        {
                            "label": "1bis.",
                            "type": "list_item",
                            "content": [
                                "Nell'ambito dell'esame di un'eventuale revoca secondo il capoverso 1 lettera e occorre considerare se la persona interessata abbia causato la dipendenza dall'aiuto sociale per propria colpa e non abbia sfruttato sufficientemente il proprio potenziale lavorativo o altre possibilit\u00e0 per non dipendere dall'aiuto sociale in maniera durevole."
                            ],
                            "children": []
                        }
                    ]
                }
            ]
        },
        {
            "label": "2",
            "type": "heading",
            "content": [
                "Art. 63 cpv. 1bis"
            ],
            "children": [
                {
                    "label": "",
                    "type": "list",
                    "children": [
                        {
                            "label": "1bis.",
                            "type": "list_item",
                            "content": [
                                "Nell'ambito dell'esame di un'eventuale revoca secondo il capoverso 1 lettera c occorre considerare se la persona interessata abbia causato la dipendenza dall'aiuto sociale per propria colpa e non abbia sfruttato sufficientemente il proprio potenziale lavorativo o altre possibilit\u00e0 per non dipendere dall'aiuto sociale in maniera durevole."
                            ],
                            "children": []
                        }
                    ]
                }
            ]
        },
        {
            "label": "1",
            "type": "heading",
            "content": [
                "II"
            ],
            "children": [
                {
                    "label": "",
                    "type": "list",
                    "children": [
                        {
                            "label": "1.",
                            "type": "list_item",
                            "content": [
                                "La presente legge sottost\u00e0 a referendum facoltativo."
                            ],
                            "children": []
                        },
                        {
                            "label": "2.",
                            "type": "list_item",
                            "content": [
                                "Il Consiglio federale ne determina l'entrata in vigore."
                            ],
                            "children": []
                        }
                    ]
                }
            ]
        }
    ]
}