{
    "label": "",
    "type": "document",
    "content": [],
    "children": [
        {
            "label": "",
            "type": "section",
            "content": [
                "Vorentwurf der KVF-S 22.407 / 22.417 f\u00fcr die Vernehmlassung"
            ],
            "children": [
                {
                    "label": "I",
                    "type": "heading",
                    "content": [
                        "Das Bundesgesetz vom 24. M\u00e4rz 2006 \u00fcber Radio und Fernsehen"
                    ],
                    "children": [
                        {
                            "label": "",
                            "type": "content",
                            "content": [
                                "Das Bundesgesetz \u00fcber Radio und Fernsehen wird wie folgt ge\u00e4ndert:"
                            ],
                            "children": []
                        },
                        {
                            "label": "Art. 1",
                            "type": "heading",
                            "content": [
                                "Sach\u00fcberschrift, Abs. 1 und 1bis \u2013 Gegenstand und Geltungsbereich"
                            ],
                            "children": [
                                {
                                    "label": "1.",
                                    "type": "paragraph",
                                    "content": [
                                        "Dieses Gesetz regelt die Veranstaltung, die Aufbereitung, die \u00dcbertragung und den Empfang von Radio- und Fernsehprogrammen, sowie die F\u00f6rdermassnahmen zugunsten der elektronischen Medien."
                                    ],
                                    "children": []
                                },
                                {
                                    "label": "1bis.",
                                    "type": "paragraph",
                                    "content": [
                                        "Soweit in diesem Gesetz nichts anderes vorgesehen ist, richtet sich die fernmeldetechnische \u00dcbertragung von Programmen nach dem Fernmeldegesetz vom 30. April 1997 (FMG)."
                                    ],
                                    "children": []
                                }
                            ]
                        },
                        {
                            "label": "Art. 2",
                            "type": "heading",
                            "content": [
                                "Bst. abis \u2013 Definition"
                            ],
                            "children": [
                                {
                                    "label": "ab.",
                                    "type": "paragraph",
                                    "content": [
                                        "In diesem Gesetz bedeuten elektronische Medien Angebote, die fernmeldetechnisch \u00fcbertragen werden, f\u00fcr die Allgemeinheit bestimmt sind und nach redaktionellen Kriterien zusammengestellt werden."
                                    ],
                                    "children": []
                                }
                            ]
                        },
                        {
                            "label": "Art. 38",
                            "type": "heading",
                            "content": [
                                "Abs. 3"
                            ],
                            "children": [
                                {
                                    "label": "3.",
                                    "type": "paragraph",
                                    "content": [
                                        "Lokalen TV-Stationen mit einer eigenst\u00e4ndigen und regelm\u00e4ssigen Berichterstattung \u00fcber nationale und kantonale Politik kann eine zus\u00e4tzliche Konzession mit Abgabenanteil erteilt werden."
                                    ],
                                    "children": []
                                }
                            ]
                        },
                        {
                            "label": "Art. 40",
                            "type": "heading",
                            "content": [
                                "Abs. 1 und 2"
                            ],
                            "children": [
                                {
                                    "label": "1.",
                                    "type": "paragraph",
                                    "content": [
                                        "Die Abgabenanteile f\u00fcr Veranstalter betragen 6 bis 8 Prozent des Ertrages der Abgabe f\u00fcr Radio und Fernsehen."
                                    ],
                                    "children": []
                                }
                            ]
                        }
                    ]
                },
                {
                    "label": "II",
                    "type": "heading",
                    "content": [
                        "Bestimmungen zum Inkrafttreten"
                    ],
                    "children": [
                        {
                            "label": "1.",
                            "type": "paragraph",
                            "content": [
                                "Dieses Gesetz untersteht dem fakultativen Referendum."
                            ],
                            "children": []
                        },
                        {
                            "label": "2.",
                            "type": "paragraph",
                            "content": [
                                "Der Bundesrat bestimmt das Inkrafttreten."
                            ],
                            "children": []
                        }
                    ]
                }
            ]
        }
    ]
}