{
    "label": "",
    "type": "document",
    "content": [],
    "children": [
        {
            "label": "1",
            "type": "heading",
            "content": [
                "Loi f\u00e9d\u00e9rale sur les \u00e9trangers et l'int\u00e9gration (LEI)"
            ],
            "children": [
                {
                    "label": "",
                    "type": "content",
                    "content": [
                        "*Avant-projet*"
                    ]
                },
                {
                    "label": "",
                    "type": "content",
                    "content": [
                        "(Pas de perte du droit de s\u00e9jour en cas de d\u00e9pendance non fautive de l'aide sociale)"
                    ]
                },
                {
                    "label": "",
                    "type": "content",
                    "content": [
                        "Modification du ..."
                    ]
                },
                {
                    "label": "",
                    "type": "content",
                    "content": [
                        "L'Assembl\u00e9e f\u00e9d\u00e9rale de la Conf\u00e9d\u00e9ration suisse,"
                    ]
                },
                {
                    "label": "",
                    "type": "content",
                    "content": [
                        "vu le rapport de la [nom de la commission du Conseil national/des Etats] du [date d\u00e9cision de la commission][^FF 2002 ...],"
                    ]
                },
                {
                    "label": "",
                    "type": "content",
                    "content": [
                        "vu l'avis du Conseil f\u00e9d\u00e9ral du [date][^FF 2002 ...],"
                    ]
                },
                {
                    "label": "",
                    "type": "content",
                    "content": [
                        "arr\u00eate:"
                    ]
                },
                {
                    "label": "",
                    "type": "content",
                    "content": [
                        "I"
                    ]
                },
                {
                    "label": "",
                    "type": "content",
                    "content": [
                        "La loi f\u00e9d\u00e9rale du 16 d\u00e9cembre 2005[^SR 142.20] sur les \u00e9trangers et l'int\u00e9gration est modifi\u00e9e comme suit:"
                    ]
                }
            ]
        },
        {
            "label": "2",
            "type": "heading",
            "content": [
                "Art. 62, al. 1bis"
            ],
            "children": [
                {
                    "label": "",
                    "type": "list",
                    "children": [
                        {
                            "label": "1bis.",
                            "type": "list_item",
                            "content": [
                                "Lors de l'examen d'une \u00e9ventuelle r\u00e9vocation selon l'al. 1, let. e, il convient d'examiner si la personne a par sa propre faute provoqu\u00e9 sa d\u00e9pendance \u00e0 l'aide sociale et si elle a insuffisamment exploit\u00e9 son potentiel de travail ou les autres possibilit\u00e9s qu'elle avait de s'affranchir durablement de l'aide sociale."
                            ],
                            "children": []
                        }
                    ]
                }
            ]
        },
        {
            "label": "2",
            "type": "heading",
            "content": [
                "Art. 63, al. 1bis"
            ],
            "children": [
                {
                    "label": "",
                    "type": "list",
                    "children": [
                        {
                            "label": "1bis.",
                            "type": "list_item",
                            "content": [
                                "Lors de l'examen d'une \u00e9ventuelle r\u00e9vocation selon l'al. 1, let. c, il convient d'examiner si la personne a par sa propre faute provoqu\u00e9 sa d\u00e9pendance \u00e0 l'aide sociale et si elle a insuffisamment exploit\u00e9 son potentiel de travail ou les autres possibilit\u00e9s qu'elle avait de s'affranchir durablement de l'aide sociale."
                            ],
                            "children": []
                        }
                    ]
                }
            ]
        },
        {
            "label": "1",
            "type": "heading",
            "content": [
                "II"
            ],
            "children": [
                {
                    "label": "",
                    "type": "list",
                    "children": [
                        {
                            "label": "1.",
                            "type": "list_item",
                            "content": [
                                "La pr\u00e9sente loi est sujette au r\u00e9f\u00e9rendum."
                            ],
                            "children": []
                        },
                        {
                            "label": "2.",
                            "type": "list_item",
                            "content": [
                                "Le Conseil f\u00e9d\u00e9ral fixe la date de l'entr\u00e9e en vigueur."
                            ],
                            "children": []
                        }
                    ]
                },
                {
                    "label": "",
                    "type": "content",
                    "content": [
                        "The image appears to be a blank white page. There is no visible text, markings, or content of any kind that I can discern or describe. The entire image consists of a uniform white background with no distinguishable features or elements."
                    ]
                }
            ]
        }
    ]
}